{
  "$schema": "https://json-schema.org/draft/2020-12/schema",
  "additionalProperties": false,
  "properties": {
    "artifact_type": {
      "type": "string"
    },
    "generated_at": {
      "type": "string"
    },
    "payload": {
      "type": "object"
    },
    "producer": {
      "additionalProperties": false,
      "properties": {
        "tool": {
          "type": "string"
        },
        "version": {
          "type": "string"
        }
      },
      "required": [
        "tool",
        "version"
      ],
      "type": "object"
    },
    "schema_version": {
      "type": "string"
    }
  },
  "required": [
    "artifact_type",
    "schema_version",
    "generated_at",
    "producer",
    "payload"
  ],
  "title": "ArtifactEnvelope",
  "type": "object"
}